{
  "$schema": "http://json-schema.org/draft-07/schema#",
  "title": "MapGen Region Config",
  "type": "object",
  "required": ["width", "height", "cellCount", "seaLevel", "countries"],
  "additionalProperties": false,
  "properties": {
    "width": { "type": "number", "minimum": 200, "maximum": 4000 },
    "height": { "type": "number", "minimum": 200, "maximum": 4000 },
    "cellCount": { "type": "number", "minimum": 50, "maximum": 2000 },
    "seaLevel": { "type": "number", "minimum": 0, "maximum": 1 },
    "mountainScale": { "type": "number", "minimum": 0.1, "maximum": 3, "default": 1.0 },
    "noiseOctaves": { "type": "number", "minimum": 1, "maximum": 8, "default": 4 },
    "latitude": { "type": "number", "minimum": -90, "maximum": 90, "default": 45 },
    "windDirection": { "type": "string", "enum": ["west", "east"], "default": "west" },
    "rivers": {
      "type": "object",
      "required": ["maxCount", "minLength"],
      "additionalProperties": false,
      "properties": {
        "maxCount": { "type": "number", "minimum": 0, "maximum": 50, "default": 5 },
        "minLength": { "type": "number", "minimum": 2, "maximum": 20, "default": 3 }
      }
    },
    "straits": {
      "type": "object",
      "required": ["maxWidth"],
      "additionalProperties": false,
      "properties": {
        "maxWidth": { "type": "number", "minimum": 1, "maximum": 10, "default": 3 }
      }
    },
    "countries": {
      "type": "array",
      "minItems": 1,
      "items": {
        "type": "object",
        "required": ["name", "archetype"],
        "additionalProperties": false,
        "properties": {
          "name": { "type": "string", "minLength": 1 },
          "archetype": { "type": "string", "enum": ["island", "landlocked", "coastal", "peninsular"] }
        }
      }
    },
    "labels": {
      "type": "object",
      "additionalProperties": { "type": "string" }
    }
  }
}
